{
  "schema_version": "eye-session.v1",
  "session_id": "0a5d5231-8473-5815-8dbf-3ce758761452",
  "data_source": "synthetic",
  "replay_origin": null,
  "coordinate_frame": "head_local",
  "start_timestamp_us": 0,
  "end_timestamp_us": 1000000,
  "capabilities": {
    "gaze": {
      "available": true,
      "reason": null
    },
    "pupil_diameter": {
      "available": false,
      "reason": "not_exposed_by_runtime"
    },
    "eyelid_openness": {
      "available": false,
      "reason": "not_exposed_by_runtime"
    },
    "confidence_informative": false
  },
  "samples": [],
  "probe_events": []
}
